AMSTELHAVENLIVE: HOTTOWN,2009-10-25,22:00,2009-10-26,03:00,300.0,Amstelhaven,Mauritskade 1,52.359229,4.906017,5.00,5.00,250,[COVERBAND],,false,false
EY,2009-10-25,21:00,2009-10-26,03:00,360.0,Bitterzoet,Spuistraat 2,52.372263,4.88949,7.50,7.50,450,"[HIPHOP, RB, OLD SKOOL, REGGAE, DUBSTEP]",,false,false
GOLD FISH LIVE,2009-10-25,21:00,2009-10-26,01:00,240.0,Club Home,Wagenstraat 4-7,52.366566,4.899401,10.00,10.00,,,[GOLD FISH],true,false
CHEGA RECORDING || CHEGA AGENCY ADE SHOWCASE,2009-10-25,22:00,2009-10-26,03:00,300.0,Club Nl,Nieuwezijds Voorburgwal 169,52.372064,4.891011,5.00,5.00,,[HOUSE],"[TOM DE NEEF, JOHNSON JUNIOR, NIKOLAI DIMITROV, REMANIAX, DANIEL DARQUE, ALEX SALVADOR, DAVE MAYER, PRAIA DE SOL, MELL TIERRA, CHIQUE BENITEZ & GEORGE ANTHONY]",false,false
HEERLIJK,2009-10-25,23:00,,,,Club Prime,Rembrandtplein 22,52.365739,4.896266,10.00,10.00,350,"[ECLECTISCHE HOUSE, SWINGBEATZ, CLASSICS SOUNDS]",,false,false
IKHEBZIN,2009-10-25,23:00,2009-10-26,03:00,240.0,Club Up,Korte Leidsedwarsstraat 26-i,,,7.50,7.50,,[ECLECTIC],"[MR MIKE, ABSTRACT, IRWAN, DEE JAY KID & MC ICEMAN]",false,false
SEE YOU LATER,2009-10-25,04:00,,,,Escape,Rembrandtplein 11,52.366428,4.896349,15.00,15.00,250,,"[HOXTON WHORES, JEAN, TONY CHA CHA, RAYMUNDO, ROBERT FEELGOOD, FREDERIK ABAS]",false,false
SUNDAY NIGHT,2009-10-25,22:00,2009-10-26,03:00,300.0,Escape,Rembrandtplein 11,52.366428,4.896349,10.00,10.00,1300,,"[KID MASSIVE, THE ETHAN PROJECT, MARC BENJAMIN, YASMIN LE BON, REMANIAX, DISFUNKTION]",false,false
DETROIT VS CHICAGO,2009-10-25,23:00,2009-10-26,04:30,330.0,Escape Delux,Amstel 70,,,10.00,12.50,,"[HOUSE, TECHNO, MINIMAL, ACID]","[ROOM 1, GENE FARRIS, DETROIT GRAND PUBAHS, ROOM 2, DJ BRIAN S, DJ ALEX PI & RUDICHI, 2RECORDZ, DJ JULIAS THE MAD THINKER 3DEGREES, MC FADOUA MAE, MC CHAPELL]",false,false
SALSA LOUNGE,2009-10-25,18:00,2009-10-26,01:00,420.0,Hotel Arena,'s-gravesandestraat 51,52.360576,4.915968,16.50,18.50,,"[LATIN, ECLECTIC, HOUSE, SALSA]",,false,false
HUSH HUSH,2009-10-25,23:00,2009-10-26,04:00,300.0,Jimmy Woo,Korte Leidsedwarsstraat 18,52.364116,4.883464,10.00,10.00,550,,"[FS-GREEN, JIM AASGIER, JAZIAH, DJ KLEVER & CRAZE]",false,false
REMOTE AREAS,2009-10-25,22:00,2009-10-26,05:00,420.0,Melkweg,Lijnbaansgracht 234a,52.364837,4.881273,12.00,14.00,,,,false,false
STAR 69 RECORDS,2009-10-25,18:00,2009-10-26,01:00,420.0,Odeon Theater,Singel 460,,,10.00,10.00,1100,,"[DEKKY, BENJAMIN AILLERY, MAN MACHINE, CHRIS BEKKER, TERRI B.]",false,false
FAITHLESS SOUNDSYSTEM LIVE,2009-10-25,22:00,2009-10-26,03:00,300.0,Panama,Oostelijke Handelskade 4,52.374931,4.930309,25.00,25.00,1000,[FAITHLESS],,false,false
RAPIDO,2009-10-25,15:00,2009-10-26,02:00,660.0,Paradiso,Weteringschans 6-8,52.362277,4.883945,32.00,32.00,1300,,,false,false
DÈJÁ VU,2009-10-25,19:00,2009-10-26,01:00,360.0,Rain,Rembrandtplein 44,52.365901,4.897413,12.50,12.50,,"[DANCE CLASSICS, RB, GLAM, SWING BEAT, SOUL]",,false,false
COCOON OFFICIAL AFTER PARTY,2009-10-25,07:00,2009-10-25,13:00,360.0,De Kroon,Rembrandtplein 17,52.366253,4.897123,10.00,10.00,530,"[TECHNO, MINIMAL]",[MYSTERY GUESTS],false,false
SUNDAY SPIRIT PRESENTS CLOSING NIGHT,2009-10-25,20:00,2009-10-26,03:30,450.0,De Kroon,Rembrandtplein 17,52.366253,4.897123,7.00,7.00,530,"[TECHNO, MINIMAL]","[DE MAN ZONDER SCHADUW, TOBI NEUMANN]",false,false
WIE HEEFT DE BAL,2009-10-25,20:30,2009-10-25,21:30,60.0,Sugarfactory,Lijnbaansgracht 238,52.364798,4.881735,12.50,12.50,450,,"[RICO, TYPHOON, MUPPETSTUFF]",false,false
WICKED JAZZ SOUNDS & NEED2SOUL PRESENT,2009-10-25,23:00,2009-10-26,05:00,360.0,Sugarfactory,Lijnbaansgracht 238,52.364798,4.881735,9.50,9.50,450,,"[DJ BENJI B, PHIL HORNEMAN, LIVE MUSICIANS]",false,false
SUNTREE LOUNGE,2009-10-25,20:30,2009-10-26,01:00,270.0,Supper,Jonge Roelensteeg 21,52.367547,4.888833,5.00,5.00,,,,false,false
RADIO DECIBEL PRESENTS: CLOSING PARTY,2009-10-25,20:00,2009-10-26,02:00,360.0,Supperclub Cruise,"Ruyterkade, Pier 14",52.379128,4.900272,10.00,10.00,800,[HOUSE],"[DJ CHUS, TOM DE NEEF, PETER GELDERBLOM, NICK & DANNY CHATELAIN, LUCIEN FOORT, JODEE KITCH., ANGEL MANUEL, NATARCIA, FREAQZ 2 HOUSE, ROY MALONE, TOMMY VEE, JORDAN RIVERA, MC PRYME, MC JACK DE RAPPER (FUTURESTREETMUSIC, NL]",false,false
TROUW OP ZONDIGMIDDAG,2009-10-25,14:00,2009-10-25,22:00,480.0,Trouw Amsterdam,Wibautstraat 131,52.354664,4.912051,10.00,12.00,,,"[MARCEL DETTMANN, PATRICE BAUMEL  & SPECIAL GUESTS]",false,false
GET DOWN SATURDAY NIGHT,2009-10-24,22:00,2009-10-25,03:00,300.0,Amstelhaven,Mauritskade 1,52.359229,4.906017,0.00,0.00,250,"[FUNKY HOUSE, CLUBCLASSICS, DE MEEST GROOVY PLATEN VAN HET MOMENT]",[DJ ELLA BROWN],false,false
YOURS TRULY,2009-10-24,22:00,2009-10-25,04:00,360.0,Bitterzoet,Spuistraat 2,52.372263,4.88949,10.00,12.50,,,"[THE FLEXICAN, FLINKE NAMEN & DIO, MOWGLI, TURNE, JAY-B, MC FIT, VJ VENOUR]",false,false
FIELD SESSION 02,2009-10-25,00:00,2009-10-24,08:00,-960.0,Boom Chicago,Leidseplein 12,52.37263,4.879139,15.00,15.00,,"[TECHNO, MINIMAL]",,false,false
UNOFFICIAL PARTY SWITCH,2009-10-24,22:00,2009-10-25,10:00,720.0,Bunker Ndsm-werf,Tt. Neveritaweg 15,52.401403,4.894345,15.00,15.00,,,,false,false
SUBTONE AND OFFERING RECORDINGS,2009-10-24,21:00,2009-10-25,03:00,360.0,Canvas,Wibautstraat 150,52.353614,4.912207,15.00,15.00,,[SOUL],,false,false
UNK,2009-10-24,23:00,2009-10-25,06:00,420.0,Club 8,Admiraal De Ruijterweg 56 B,52.371242,4.86195,8.00,9.00,250,,,false,false
CLICK CONDITION ADE AFTERHOUR,2009-10-24,05:00,2009-10-24,12:00,420.0,Club Home,Wagenstraat 3,52.366566,4.899401,10.00,10.00,,"[HOUSE, TECHNO]",[VERY SPECIAL  GUEST DJS],false,false
OBJEKTIVITY LABEL NIGHT,2009-10-24,23:00,2009-10-25,05:00,360.0,Club Home,Wagenstraat 4-7,52.366566,4.899401,12.00,15.00,,,,false,false
HERTZ_ CONDITION INVITES,2009-10-24,22:00,2009-10-25,05:00,420.0,Club Nl,Nieuwezijds Voorburgwal 169,52.372064,4.891011,10.00,10.00,,,"[JAMES NIDECKER, FRANKLIN REEVES, OSCAR, VAN MEETEREN&HYDE, LIN, JAMA, JAMY WING, MARCUS GEHRING]",false,false
DE HEEREN VAN AEMSTEL LIVE,2009-10-24,22:30,,,,De Heeren Van Aemstel,Thorbeckeplein 5,52.365552,4.895929,,,,,,false,false
ELEVATOR PEOPLE LABELNIGHT,2009-10-24,22:00,2009-10-25,04:00,360.0,De Kring,Kleine Gartmansplantsoen 7-9,52.363575,4.883355,8.00,10.00,,,,false,false
FRAMEBUSTERS SPECIAL,2009-10-24,23:00,2009-10-25,05:00,360.0,Escape,Rembrandtplein 11,52.366428,4.896349,20.00,20.00,1300,[HOUSE],"[CHUCKIE, SUNNERY JAMES & RYAN MARCIANO, AFROJACK, RAYMUNDO, RICKY RIVARO, SHERMANOLOGY, JAZIAH, DANIEL BOVIE & ROY ROXX, CARITA LA NINA, REHAB, HITMEISTER D, TOM DE NEEF, PAKO & FREDERIK]",false,false
SNEAKERZ MUZIK OFFICIAL ADE SHOWCASE,2009-10-24,22:00,2009-10-25,05:00,420.0,Escape Delux,Amstel 70,52.366428,4.896349,7.50,10.00,250,,,false,false
SONIC BOOM,2009-10-24,22:00,2009-10-25,05:00,420.0,Flex Bar,Pazzanistraat 1,52.385827,4.871706,9.00,10.00,,"[ELECTRO, DUBSTEP, HIP HOP]","[HUORATRON, SCHLACHTHOFBRONX, TOMB CREW, AAVIKOO, KITTY GOT SUED, BRUTUZZ, THE LONGMEN]",false,false
FUTURE GENERATIONS & BAALSAAL LABELNIGHT,2009-10-24,23:00,2009-10-25,07:00,480.0,Godiva,Handboogstraat 15hs,52.373801,4.890935,10.00,10.00,,"[TECHNO, MINIMAL]","[FRITZ KALKBRENNER, CHOPSTICK, JOHNJON, TINLEI, JIVE]",false,false
HED KANDI,2009-10-24,22:00,2009-10-25,05:00,420.0,Hotel Arena,'s-gravesandestraat 51,52.360576,4.915968,15.00,20.00,,,,false,false
JIMMY WOO PRESENTS,2009-10-24,23:00,2009-10-25,04:00,300.0,Jimmy Woo,Korte Leidsedwarsstraat 18,52.364116,4.883464,15.00,17.50,550,,"[VILLA, JUNKIE XL]",false,false
JUST JACK,2009-10-24,19:30,2009-10-24,23:00,210.0,Melkweg,Lijnbaansgracht 234a,52.364837,4.881273,15.00,15.00,,,[JUST JACK],false,false
CREME ORGANIZATION & INTERGALACTIC FM PRESENT,2009-10-24,22:00,2009-10-25,05:00,420.0,Melkweg,Lijnbaansgracht 234a,52.364837,4.881273,12.00,12.00,,,,false,false
SUB:STANCE VS. SONIC WARFARE,2009-10-24,22:00,2009-10-25,05:00,420.0,Melkweg,Lijnbaansgracht 234a,52.364837,4.881273,13.00,13.00,,,"[BOXCUTTER, APPLEBLIM, JAMIE VEXD, SCUBA, PAUL SPYMANIA, JUHA]",false,false
THIS IS OUR NIGHT,2009-10-24,23:00,2009-10-25,05:00,360.0,Melkweg,Lijnbaansgracht 234a,52.364837,4.881273,15.00,20.00,,,[SANDER KLEINENBERG],false,false
THE WESTCOAST SOUND OF HOLLAND,2009-10-24,23:00,2009-10-25,05:00,360.0,Melkweg,Lijnbaansgracht 234a,52.364837,4.881273,12.00,14.00,,[ELECTRO],,false,false
STUDIO MTV INVITES DANCE4LIFE & ART OF DANCE,2009-10-24,21:00,2009-10-25,04:00,420.0,Mtv Studios,Tt. Neveritaweg 6,52.400121,4.893654,17.50,20.00,,,,false,false
GIRLSLOVEDJ'S PRESENTS,2009-10-24,23:00,2009-10-25,05:00,360.0,Odeon Theater,Singel 460,,,15.00,17.00,1100,[CLUB],"[KLEVER, DJ CRAZE, JAZIAH, MISSINGLINKS, RUBYWAX, JIM AASGIER & NIZZLE, LARS VEGAS, TOMDAMIENLO, OSLO HILTON, RUBIX.]",false,false
TOPBILLIN' ELECTRONICAN,2009-10-24,21:00,2009-10-25,02:00,300.0,Onefourone,Overtoom 141,52.362071,4.87295,10.00,10.00,,"[ALTERNATIVE DANCE, HIP HOP]",,false,false
BASSERK LABEL NIGHT,2009-10-24,23:00,2009-10-25,05:00,360.0,Ot301,Overtoom 301,52.360186,4.865394,10.00,10.00,400,[ALTERNATIVE DANCE],"[RICKY Y RULO, BRONSTIBOCK, CAPACOCHA, RAWFARE, LAZY LATE KIDZ, GTRONIC]",false,false
GO DUTCH,2009-10-24,22:00,2009-10-25,04:00,360.0,Panama,Oostelijke Handelskade 4,52.374931,4.930309,12.50,15.00,1000,[HOUSE],,false,false
DEKMANTEL,2009-10-24,23:30,2009-10-25,05:30,360.0,Paradiso,Weteringschans 6-8,52.362277,4.883945,17.50,17.50,1300,[DISCO],"[DERRICK MAY, DISCO 3000, SADAR BAHAR, CASPER TIELROOIJ, KEITH WORTHY, THOMAS MARTOJO, ANTAL, SAN PROPER]",false,false
STROM RECORDINGS & JOYRIDERS SHOWCASE,2009-10-24,23:00,2009-10-25,05:00,360.0,Rain,Rembrandtplein 44,52.365901,4.897413,12.00,17.00,,"[ELECTRO, HIP HOP, HOUSE]","[WHEN HARRY MET SALLY & TESS IS MORE, JAMES NIDECKER & FRANKLIN REEVES, K-FRESH, MR SPEAK, JAY B, MO MC]",false,false
PLAYECTRA LABELNIGHT,2009-10-24,21:00,2009-10-25,03:00,360.0,St. Pauls,Gravenstraat 24 B,52.374253,4.891853,0.00,0.00,200,[HOUSE],"[DJ AMIR, JEFREAK, RISHI RICARDO, WALDORF & STATLER, GFREAXX, FRANKY SWEETZ, JODY MEYER, VELVET, COLL SELINI]",false,false
24 HOUR PARTY PEOPLE SUPPLEMENT FACTS,2009-10-24,09:00,2009-10-24,20:00,660.0,De Kroon,Rembrandtplein 17,52.366253,4.897123,10.00,12.00,530,"[TECHNO, MINIMAL]","[ITALOBOYZ, ILLE BITCH & UNDERS, MORITZ, FLOWING]",false,false
WTTF PRESENTS: MOON HARBOUR & SOWESO & WHATPEO,2009-10-24,23:00,2009-10-25,13:00,840.0,De Kroon,Rembrandtplein 17,52.366253,4.897123,14.00,14.00,530,"[TECHNO, MINIMAL]","[MATTHIAS TANZMANN, LUNA CITY EXPRESS, BORIS WERNER, DAN DRASTIC, LAUHAUS, KABALE UND LIEBE, MAAYAN NIDAM, MAKAM, MARC SCHNEIDER]",false,false
VRIJBUITERS GO BERLIN UNDERGROUND,2009-10-24,22:00,2009-10-25,10:00,720.0,Studio/k,Timorplein 62,52.365581,4.935035,15.00,15.00,,,"[ONNO, MAKCIM, DAN GHENACIA, ANTHONY COLLINS, REISS, OLENE KADAR, DE MAN ZONDER SCHADUW, KRAUSE DUO, JACKMATE, SANDRIEN, FRODO, RAMCHEZ, PEP, KAREEM RAIHANI, QUARTIER MUSTACHE]",false,false
"IDEAL AUDIO, HERZBLUT & PICKADOLL NIGHT",2009-10-24,23:00,2009-10-25,05:00,360.0,Sugarfactory,Lijnbaansgracht 238,52.364798,4.881735,15.00,15.00,450,,,false,false
DIGITALSOUL & OM RECORDS,2009-10-24,23:00,2009-10-25,03:00,240.0,Supper,Jonge Roelensteeg 21,52.367547,4.888833,10.00,15.00,,[SOUL],"[PEZZNER LIVE, SOUL MIGRANTZ, DEKKY, JEFF ALEXANDER, STEVE BOOMSELECTER, DJ HEATHER, DJ FLUID, AL VELILLA, IAN SOUL, DRU69]",false,false
FETTE SJIT (PHAT SH*T) LIVE,2009-10-24,23:00,2009-10-25,08:00,540.0,Supperclub Cruise,"Ruyterkade, Pier 14",52.379128,4.900272,15.00,19.00,800,[HOUSE],"[CHRIS LAKE, TOM DE NEEF, MASTIKSOUL, PETER GELDERBLOM, NICK & DANNY CHATELAIN, LUCIEN FOORT, BAGGI BEGOVIC, DJ CHUS, JODEE KITCH., OZ ROMITA, ANGEL MANUEL, NATARCIA, FREAQZ 2 HOUSE, ROY MALONE, TOMMY VEE, JORDAN RIVERA, EDWIN DIERGAARDE, MC PRYME, MC JACK DE RAPPER, SHEREETHA CAMPELL]",false,false
AN AMSTERDAM DANCE EVENT SPECIAL,2009-10-24,23:00,2009-10-25,04:00,300.0,The Mansion,Hobbemastraat 2,52.361452,4.882344,10.00,10.00,,,,false,false
COCOON GOES AMSTERDAM,2009-10-24,22:00,2009-10-25,06:00,480.0,The Powerzone,Daniel Goedkoopstr. 1-3,52.343369,4.918505,32.50,40.00,3500,"[MINIMAL, HOUSE, TECHNO]","[SVEN VÄTH, KAROTTE, EXTRAWELT, MARKUS FIX, RAUWKOST, LOOPS, DANIEL SANCHEZ, JOEY DANIEL, OLIVIER WEITER]",false,false
ONE LOVE: DAVID GUETTA,2009-10-24,23:00,2009-10-25,05:00,360.0,The Sand,Rhoneweg 36/1,52.390402,4.824743,33.00,33.00,3000,,"[DAVID GUETTA, CHUCKIE, AFROJACK]",true,false
RESIDENT ADVISOR,2009-10-24,22:30,2009-10-25,05:00,390.0,Trouw Amsterdam,Wibautstraat 131,52.354664,4.912051,15.00,17.50,,,,false,false
VINYLIZED FINAL FIVE & TWSTD AFTERPARTY,2009-10-24,20:00,,,,Twstd,Weteringschans 157,52.359747,4.889935,0.00,0.00,200,[SOUL],"[ARJUNA SCHIKS, JULIUS GELUK, TIM WOLFF, AUDIOMILCH, SEBASTIAN SLEEBOS, GINEERZ OF SOUL, SHOCK ROYAL, KEVIN ARNEMANN & TEATRO KULTKA]",false,false
OBSESSIONZ,2009-10-24,23:00,2009-10-25,04:00,300.0,Vak Zuid,Olympisch Stadion 35,52.344575,4.854739,15.00,25.00,900,"[ECLECTIC, LATINHOUSE, HOUSE, SALSA]","[D-RASHID, THE PARTYSQUAD, IRWAN, FLAVA, SMASH PARKER, W.PEREIRA, QUINTTIN, MAURI, MC O, BRACE]",false,false
"YES, PLEASE! INVITES THE FAMILY",2009-10-24,22:00,2009-10-25,05:00,420.0,Werck,Prinsengracht 277,52.374974,4.883672,,,,,"[JEREMY, OSCAR P, ROBERTO DE CARLO, BLACKSOUL, GROOVESERVICE, SERGIO FLORES, LE ROI]",false,false
LOVELAND,2009-10-24,22:00,2009-10-25,06:00,480.0,Westerunie,Klönne Plein 4-6,52.386808,4.869991,20.00,25.00,1200,[DISCO],,false,false
THE BLOG PARTIES,2009-10-24,22:00,2009-10-25,05:00,420.0,Winston Int.,Warmoesstraat 131,,,7.00,7.00,,[ALTERNATIVE DANCE],,false,false
G-SHOCK PRESENTS: VICE PARTY,2009-10-23,23:00,2009-10-24,04:00,300.0,Bitterzoet,Spuistraat 2,52.372263,4.88949,,,,,"[GOLDEN BUG, TELONIUS, MOULLINEX, MANUEL KIM]",false,false
JOHN DAHLBACK & FRIENDS,2009-10-24,00:00,2009-10-23,07:00,-1020.0,Boom Chicago,Leidseplein 12,52.37263,4.879139,15.00,15.00,,,,false,false
AMSTERDAM DANCE CLASH,2009-10-23,22:00,2009-10-24,06:00,480.0,Bulldog Palace,Leidseplein,52.366352,4.887227,0.00,0.00,450,"[GROOVE, SOULFULL DEEP FUNKY LATIN, TECHOUSE]","[D.O.N.S., DR KUCHO, ROB BOSKAMP, MIKE L., DK WATTS, ONNIK, BEATTHIEFS, LUCKY CHARMES, TONY VERDULT, DIRTYROCKERS, DAMIEN J CARTER, NICK FIORUCCI, DAVE RAMONE, DJ EEVEE, MC LOU-E]",false,false
KWAST,2009-10-23,22:00,2009-10-24,03:00,300.0,Canvas,Wibautstraat 150,52.353614,4.912207,10.00,10.00,,[DRUM N BASS],,false,false
AMSTERDAM SOUND PRESENTS,2009-10-23,22:00,2009-10-24,04:00,360.0,Club 8,Admiraal De Ruijterweg 56 B,52.371242,4.86195,8.00,9.00,250,,,false,false
"EVERY FRIDAY \"\"LATIN POP NIGHT",2009-10-23,23:00,2009-10-24,05:00,360.0,Club Candela,Korte Leidsestraat 85-87,,,5.00,5.00,250,"[LATIN, POP]","[DJ PORTILLA, DJ NXT, DJ EYE]",false,false
FAMOUS,2009-10-23,23:00,2009-10-24,05:00,360.0,Club Home,Wagenstraat 4-7,52.366566,4.899401,12.50,12.50,,,"[JEROME ISMA-AE, MATTHEW DEKAY, GLENN MORRISON, REMY, RAVENE VOLUZ]",false,false
VUIG,2009-10-23,23:00,2009-10-24,14:00,900.0,Club Mp3,Voetboogstraat 3,,,10.00,10.00,,[HOUSEMUSIC],,false,false
FLOORPLAY,2009-10-23,22:00,2009-10-24,05:00,420.0,Club Nl,Nieuwezijds Voorburgwal 169,52.372064,4.891011,10.00,10.00,,,,false,false
LATINXPERIENCE,2009-10-23,22:00,2009-10-24,06:00,480.0,Club Prime,Rembrandtplein 22,52.365739,4.896266,7.00,7.00,350,"[FUNKY GROOVY LATINHOUSE, TRUEHOUSE, TECHOUSE]","[REAL EL CANARIO, JEAN ELAN, MIKE L., ROB BOSKAMP, DENNIS THE MENACE, BIG WORLD, SERGIO FLORES, JODEE KITCH, JORDAN RIVERA, DJ Q, JAY BUCA, LE MAR, MC AWI, REMKO SMID ON SAX]",false,false
UPTOWN EXPRESS,2009-10-23,,,,,Club Up,Korte Leidsedwarsstraat 26-i,,,8.00,8.00,,[DISCO],"[DANIEL WANG ), BEPPE LODA, TOM TRAGO, TAKO, DISCO EXOTA, GSTRING, MARCO & ORPHEO), MARCUS, MELCHIOR, STRANGE BOUTIQUE, AFROBOT]",false,false
DE HEEREN VAN AEMSTEL LIVE,2009-10-23,22:30,,,,De Heeren Van Aemstel,Thorbeckeplein 5,52.365552,4.895929,,,,[NEDERLANDSTALIG],,false,false
DISCO DISCO YOWSAH,2009-10-23,22:00,2009-10-24,04:00,360.0,De Kring,Kleine Gartmansplantsoen 7-9,52.363575,4.883355,8.00,8.00,,[DISCO],"[DANIEL WANG, TOM TRAGO, TAKO, GSTRING, MARCO & OPRHEU, STRANGE BOUTIQUE]",false,false
RAYMUNDO INVITES REMANIAX,2009-10-23,23:00,2009-10-24,03:00,240.0,De Kroon,Rembrandtplein 17,52.366492,4.8967,0.00,0.00,,"[HOUSE, CLUB, TECHHOUSE, ELECTRO]","[RAYMUNDO, REMANIAX]",false,false
THE BEST OF PAUL VAN DYK,2009-10-23,22:00,2009-10-24,05:00,420.0,Escape,Rembrandtplein 11,52.366428,4.896349,22.50,27.50,1300,,"[PAUL VAN DYK, GIUSEPPE OTTAVIANI, FILO & PERI, STEVE MULDER]",false,false
THE 5 BEATS,2009-10-23,23:00,2009-10-24,05:00,360.0,Escape Delux,Amstel 70,52.366994,4.896383,12.50,15.00,,,"[MANOO, ROCCO, ALIX ALVAREZ, MR. V, FRANCK ROGER]",false,false
BATERIA,2009-10-23,23:00,2009-10-24,04:00,300.0,Escape Delux,Amstel 70,52.366428,4.896349,12.50,12.50,250,[BASS],,false,false
HEROES,2009-10-23,22:00,2009-10-24,05:30,450.0,Flex Bar,Pazzanistraat 1,52.385827,4.871706,12.00,15.00,,[DISCO],,false,false
THE KARAOKE BAR EXTRA LONG,2009-10-23,23:00,2009-10-24,08:00,540.0,Godiva,Handboogstraat 15hs,52.373801,4.890935,8.00,10.00,,"[TECHNO, MINIMAL]","[MATTHIJS GROOS & FLORIAN RATH, MARK AUGUST, DASO LIVE, DE MAN ZONDER SCHADUW, DANIEL MEHLHART, JAMA & MYSTERY GUEST]",false,false
GROOVE ARMADA PRESENTS: BLACKLIGHT,2009-10-23,21:00,2009-10-24,06:00,540.0,Heineken Music Hall,Arena Boulevard 1,,,35.00,35.00,,,,false,false
HOUSEXY,2009-10-23,23:00,2009-10-24,05:00,360.0,Hotel Arena,'s-gravesandestraat 51,52.360576,4.915968,15.00,18.00,,,"[FREEMASONS, ERICK E, DENNIS CHRISTOPHER, PATRICK HAGENAAR, GREG VAN BUEREN, SEBASTIAN DAVIDSON, DEKKY, MC CHORAL]",false,false
STEALTH LIVE,2009-10-23,22:00,2009-10-24,05:00,420.0,Jimmy Woo,Korte Leidsedwarsstraat 18,52.364116,4.883464,15.00,15.00,550,,,false,false
MAKING CONTAKT,2009-10-23,19:00,,,,Melkweg,Lijnbaansgracht 234a,52.364837,4.881273,10.00,10.00,,,,false,false
LAURENT GARNIER (LIVE,2009-10-23,20:30,2009-10-23,23:00,150.0,Melkweg,Lijnbaansgracht 234a,52.364837,4.881273,17.50,17.50,,,,false,false
DAVE CLARKE PRESENTS,2009-10-23,22:00,2009-10-24,05:00,420.0,Melkweg,Lijnbaansgracht 234a,52.364837,4.881273,18.00,18.00,,,,false,false
STUDIO MTV INVITES TOPNOTCH,2009-10-23,21:00,2009-10-24,04:00,420.0,Mtv Studios,Tt. Neveritaweg 6,52.400121,4.893654,10.00,10.00,,[HARDERE STIJLEN],,false,false
PIEKUP: UPON YOU,2009-10-23,23:00,2009-10-24,09:00,600.0,Odeon Theater,Singel 460,,,13.00,15.00,1100,"[TECHNO, MINIMAL]",,false,false
"HEADQUARTERS, HOMEBASE FOR BEATLOVERS",2009-10-23,21:00,2009-10-24,02:00,300.0,Onefourone,Overtoom 141,52.362071,4.87295,6.00,6.00,,[HIP HOP],,false,false
BOMB DIGGY,2009-10-24,00:00,2009-10-23,05:00,-1140.0,Ot301,Overtoom 301,52.360186,4.865394,10.00,10.00,400,,"[TOMMY TEQUILA, MAKKS, FILASTINE, MATAKLAP, DANIEL HAAKSMAN, OCTA PUSH]",false,false
STRICTLY DEFECTED,2009-10-23,22:00,2009-10-24,04:00,360.0,Panama,Oostelijke Handelskade 4,52.374931,4.930309,17.50,17.50,1000,,,false,false
OI! INVITES DUB POLICE,2009-10-24,00:00,2009-10-23,05:00,-1140.0,Paradiso,Weteringschans 6-8,52.362277,4.883945,15.00,15.00,1500,[DUBSTEP],,false,false
STONEBRIDGE & FRIENDS: INDEPENDANT BOOKINGS,2009-10-23,23:00,2009-10-24,05:00,360.0,Rain,Rembrandtplein 44,52.365901,4.897413,7.00,12.00,,,"[STONEBRIDGE, MATT JOKO, LIL JOEY, IRWAN, FLAVA, RISHI ROMERO, MC ICEMAN]",false,false
PLAYECTRA LABELNIGHT,2009-10-23,21:00,2009-10-24,02:00,300.0,St. Pauls,Gravenstraat 24 B,52.374253,4.891853,0.00,0.00,200,[HOUSE],"[CHRIS SALMAN & VINCENT NOVAL, LUGAR, JAQUELINO FERREIRA, SQUEEZE, DJ QRIUS, THE BOARDROOM]",false,false
ITEC & HEY! RECORDINGS & HIGHLAND BEATS,2009-10-23,17:00,2009-10-23,22:00,300.0,De Kroon,Rembrandtplein 17,52.366253,4.897123,,,530,"[TECHNO, MINIMAL]","[MICHEL DE HEY, JON RUNDELL, JAN LIEFHEBBER, LONE STRIKER, PAUL SPARKES, MC MARXMAN]",false,false
AGENT AUDIO & BABYLON,2009-10-23,22:00,2009-10-24,05:00,420.0,De Kroon,Rembrandtplein 17,52.366253,4.897123,12.00,14.00,530,,"[DAVIDE SQUILLACE, LUCA BACCHETTI, MICHEL DE HEY, ISIS, PRESETONE, JUAN SANCHEZ, MIKE SHERIDAN]",false,false
THE UNIVERSE & GO BANG,2009-10-23,22:30,2009-10-24,04:00,330.0,Studio/k,Timorplein 62,52.365581,4.935035,9.00,10.00,,,"[MAURICE FULTON, KYLE HALL, THE PLEASE, DOMINGGUS, EELCO COUVREUR, THOMAS MARTOJO, CASPER TIELROOIJ]",false,false
MN2S,2009-10-24,00:00,2009-10-23,04:00,-1200.0,Sugarfactory,Lijnbaansgracht 238,52.364798,4.881735,,,450,,,false,false
NO GUTS NO GLORY (ALBUMRELEASE,2009-10-23,20:00,2009-10-24,00:00,240.0,Sugarfactory,Lijnbaansgracht 238,52.364798,4.881735,9.50,9.50,450,,,false,false
PURPLE MUSIC NIGHT,2009-10-23,22:00,2009-10-24,06:00,480.0,Supper,Jonge Roelensteeg 21,52.367547,4.888833,11.99,11.99,,"[HOUSE, FUNK]","[JAMIE LEWIS, DJ MEME, ALFRED AZZETTO, ANTHONY ROMENO, RICHARD EARNSHAW, BAZ, MIKE SCOT, PANEVINO, JUSTIN MICHAEL, BORN TO FUNK, MARLY MAR, ALAN LUNA]",false,false
MISS NINE INVITES,2009-10-23,23:30,2009-10-24,06:00,390.0,Supperclub Cruise,"Ruyterkade, Pier 14",52.379128,4.900272,9.99,9.99,800,,"[MISS NINE, 16 BIT LOLITAS, DENNIS RUYER, GLOWFIELD, THE FUNKY BASTARD, MPLAY]",false,false
THE DRUMCLUB,2009-10-23,22:00,2009-10-24,04:00,360.0,The Mansion,Hobbemastraat 2,52.361452,4.882344,10.00,10.00,,,,false,false
MINUS NIGHT BY RICHIE HAWTIN,2009-10-23,22:00,2009-10-24,06:00,480.0,The Powerzone,Daniel Goedkoopstr. 1-3,52.343369,4.918505,32.50,32.50,3500,"[MINIMAL, TECHNO]","[RICHIE HAWTIN, BAREM, MAGDA, JPLS, HOBO, FABRIZIO MAURIZI, AMBIVALENT, ALI M DEMIREL]",false,false
PLANET E VS REKIDS,2009-10-23,22:30,2009-10-24,05:00,390.0,Trouw Amsterdam,Wibautstraat 131,52.354664,4.912051,15.00,17.50,,,"[CARL CRAIG  & RADIO SLAVE  - BACK-TO-BACK EXTRA LONG SET FEAT. ‘MAD MIKE BANKS ON KEYBOARDS, SPENCER PARKER]",false,false
DOMMELSCH TWSTD DJ CONTEST,2009-10-23,20:00,2009-10-24,03:00,420.0,Twstd,Weteringschans 157,52.359747,4.889935,0.00,0.00,200,,,false,false
"YES, PLEASE",2009-10-23,22:00,2009-10-24,05:00,420.0,Werck,Prinsengracht 277,52.374974,4.883672,,,,[SOUL],"[ALEXANDRE ESCOLIER, HANNA HAIS, DJ PIPPI, CHAPPELL, RALF GUM, DANNY MARQUEZ, FUDGE, GREG VAN BUEREN]",false,false
CLICK,2009-10-23,23:00,2009-10-24,06:00,420.0,Westerunie,Klönne Plein 4-6,52.386808,4.869991,15.00,15.00,1200,"[SOUL, FUNK]",,false,false
REDNOSE DISTRIKT,2009-10-24,00:00,2009-10-23,05:00,-1140.0,Winston Int.,Warmoesstraat 131,,,7.50,7.50,,[DUBSTEP],,false,false
PITCH BLACK,2009-10-23,20:00,2009-10-24,00:00,240.0,Winston Int.,Warmoesstraat 131,,,8.00,8.00,,[DOWNTEMPO],,false,false
ON THA FLOOR MUSIC NETWORK GATHERING,2009-10-22,20:00,2009-10-23,01:00,300.0,Bar Arc,Reguliersdwarsstraat 44,,,0.00,0.00,,[BASS],"[DJ DLG, HOXTON WHORES, MAT PLAYFORD, RACHAEL STARR, REDROCHE, TOM BUDDEN, TOM DE NEEF, LUCKY CHARMES, NICKY ROMERO, ROBERT FEELGOOD, SEDUCTIVE, AFRO BROS, ROWEL SINESTER, DEKKY, SILVERIUS, JAY SANTI]",false,false
AMSTERDAM DANCE EVENT SPECIAL,2009-10-22,20:30,2009-10-23,01:00,270.0,Bimhuis,Piet Heinkade 3,52.375765,4.924412,12.00,12.00,,[EXPERIMENTAL],,false,false
PLAT DU JOUR,2009-10-22,20:00,2009-10-23,03:00,420.0,Bitterzoet,Spuistraat 2,52.372263,4.88949,8.00,8.00,,"[DUBSTEP, DRUM N BASS, HIP HOP]","[RUSTIE, MOCHIPET, BRUTUZZ, MAKKS, ROKUS]",false,false
STOLICHNAYA KOMMUNITY INVADES AMSTERDAM,2009-10-22,18:00,2009-10-22,22:00,240.0,Bright Young Things Gallery,Eerste Jacob Van Campenstraat 60,52.357381,4.890322,,,,,"[NUNO DOS SANTOS, THE PLEASE, ERIC B YOUNG.]",false,false
6 YEARS OF LITTLE MOUNTAIN ROCKS,2009-10-22,23:00,2009-10-23,04:00,300.0,Club Home,Wagenstraat 4-7,52.366566,4.899401,10.00,15.00,,,,false,false
DEEPHEAT BEYOND BOOKINGS,2009-10-22,22:00,2009-10-23,04:00,360.0,Club Nl,Nieuwezijds Voorburgwal 169,52.372064,4.891011,10.00,10.00,,,"[HARDSOUL, HIDEO KOBAYASHI, SERGIO FLORES, DANNY MARQUEZ, FUDGE, RALF GUM, SIMON DUNMORE, I-FAN, MITCH CROWN]",false,false
DIRTY DELUXE,2009-10-22,22:00,2009-10-23,04:00,360.0,Club Party Crew,Rembrandtplein 31,,,10.00,12.00,300,"[HOUSE, ECLECTIC]","[KID KAIO, LENNOX FREDERIQUE, MIQSTAR & JAY ARE, DAH COSTAH, ALVITA, NICK MEMPHIS, VIPS, SHARITY JAYDE & FRIENDS]",false,false
MASON PRESENTS: ANIMAL LANGUAGE LABEL NIGHT,2009-10-22,23:00,2009-10-23,04:00,300.0,Club Up,Korte Leidsedwarsstraat 26-i,,,12.00,12.00,,,,false,false
ANIMAL LANGUAGE LABELNIGHT,2009-10-22,23:00,2009-10-23,04:00,300.0,De Kring,Kleine Gartmansplantsoen 7-9,52.363575,4.883355,12.00,12.00,,,"[01.00 LUKE SOLOMON ), 02.30 TIM GREEN]",false,false
FLAMINGO NIGHTS,2009-10-22,22:00,2009-10-23,04:00,360.0,Escape,Rembrandtplein 11,52.366428,4.896349,12.00,12.00,1300,[FUNK],"[FEDDE LE GRAND, FUNKERMAN, PATRIC LA FUNK, BJORN WOLF, JOHNSTAR, SHERMANOLOGY, MITCH CROWN, MC GEE]",false,false
ANNA AGENCY PRESENTS,2009-10-22,22:00,2009-10-23,03:00,300.0,Escape Lounge Caffe,Rembrandtplein,,,,,,,"[BART B MORE, BENJAMIN BATES PRESENTS BATES45, BOBBY BURNS, HARDWELL, JEAN, KOEN GROENEVELD, MC BOOGSHE, OLAV BASOSKI, RANDY KATANA, RAY FOX, RONALD MOLENDIJK, TONY CHA CHA]",false,false
BEASONE LABEL NIGHT,2009-10-22,22:00,2009-10-23,04:00,360.0,Flex Bar,Pazzanistraat 1,52.385827,4.871706,12.50,15.00,,"[TECHNO, MINIMAL]",,false,false
SQUZ,2009-10-22,22:00,2009-10-23,05:00,420.0,Godiva,Handboogstraat 15hs,52.373801,4.890935,8.00,8.00,,,"[DANIEL BRANDT, BERT DE ROOIJ, DOLLKRAUT, OLFF, EELCO COUVREUR, TOM RUIJG, WILLIAM KOUAM DJOKO, PETE BANDIT, JASON SHAE, KHALIL, JORN LIEFDESHUIS]",false,false
JOHNNY HOES PRESENTS,2009-10-22,23:00,2009-10-23,04:00,300.0,Jimmy Woo,Korte Leidsedwarsstraat 18,52.364116,4.883464,12.50,12.50,550,,[DON DIABLO & FRIENDS],false,false
SUPERRAUW & DECKED OUT,2009-10-22,22:00,2009-10-23,05:00,420.0,Melkweg,Lijnbaansgracht 234a,52.364837,4.881273,23.00,23.00,,,,false,false
BLA BLA / MOBILEE / DEEPVIBES LABEL SHOWCASE,2009-10-22,23:00,2009-10-23,05:00,360.0,Ms Stubnitz,Neveritaweg,52.401412,4.89436,5.00,12.00,,"[TECHNO, MINIMAL]","[PACO OSUNA, DANIEL SANCHEZ, WOUTER DE MOOR, OLENE KADAR LIVE, VERY SPECIAL GUEST!!, MULDER & RODERIK FLOHIL AND WIETSE SMIT, HECTOR, RALF KOLLMANN, ROBERT DIETZ, SASCHA DIVE, EL MUNDO & SATORI]",false,true
FLASH BLACK,2009-10-22,22:00,2009-10-23,06:00,480.0,Odeon Theater,Singel 460,,,10.00,15.00,1100,,,false,false
