GROUND UP SHOWCASE,2009-10-22,21:00,2009-10-23,02:00,300.0,Onefourone,Overtoom 141,52.362071,4.87295,5.00,5.00,,[ELECTRO],,false,false
"ADE MOSKOW DISKOW PRESENTS:L \"\"BE EAST",2009-10-22,21:00,2009-10-23,03:00,360.0,Ot301,Overtoom 301,52.360186,4.865394,9.00,10.00,400,,,false,false
BEDROCK FT. JOHN DIGWEED & GUY J,2009-10-22,22:00,2009-10-23,04:00,360.0,Panama,Oostelijke Handelskade 4,52.374931,4.930309,20.00,25.00,1000,,,false,false
PENDULUM (DJ SET,2009-10-22,22:00,2009-10-23,05:00,420.0,Paradiso,Weteringschans 6-8,52.362277,4.883945,18.00,18.00,1300,"[BREAKBEATS, DRUM N BASS]",,false,false
INTUITION INVITES COLD HARBOUR & GARUDA,2009-10-22,22:00,2009-10-23,05:00,420.0,Partyship Ocean Diva,"Passenger Terminal, Piet Heinkade 2",,,17.50,20.00,,"[TRANCE, PROGRESSIVE]","[MARKUS SCHULZ, MENNO DE JONG, GARETH EMERY]",false,false
STAR 69RECORDS SHOWCASE,2009-10-22,22:00,2009-10-23,04:00,360.0,Rain,Rembrandtplein 44,52.365901,4.897413,5.00,10.00,,,"[HOXTON WHORES, STEVEN LEE, AGENT GREG, DMITRI VEGAS, LIKE MIKE, ANTON FIELDING, NIMA NAS, TERRI B., RICHARD GREY, TERRI B.]",false,false
PLAYECTRA LABELNIGHT,2009-10-22,21:00,2009-10-23,02:00,300.0,St. Pauls,Gravenstraat 24 B,52.374253,4.891853,0.00,0.00,200,[HOUSE],,false,false
WKND PRESENTS DIYNAMIC & FREERANGE,2009-10-22,21:00,2009-10-23,03:30,390.0,De Kroon,Rembrandtplein 17,52.366253,4.897123,8.00,10.00,530,,"[SOLOMUN, STIMMING, H.O.S.H., JIMPSTER, MANUEL TUR, ILLE BITCH, TIM AVIS]",false,false
MIKO LOVES WAVE MUSIC & FORWARD,2009-10-23,00:00,2009-10-22,05:00,-1140.0,Sugarfactory,Lijnbaansgracht 238,52.364798,4.881735,10.00,14.00,450,[HOUSE],"[FRANÇOIS K., BRENDON MOELLER, JOHN DALY, MOSFET VISUALISTS]",false,false
SHARE / AUDIO VISUAL PLAYGROUND,2009-10-22,15:00,2009-10-22,19:00,240.0,Sugarfactory,Lijnbaansgracht 238,52.364798,4.881735,5.00,5.00,450,,"[MATTHIJS KNEPPERS, NEDAD POPOV, JUSTIN MAGNESS, STIJN KUIJPERS, ROY BEKHUIS, ANETT KULCSAR, CENK UNIS, MARCEL VAN DER DRIFT, BRAM KNEPPERS, TIMO ROZENDAL, WIETSKE HUISMAN]",false,false
365LIVE! WORKSHOP & MASTERCLASS,2009-10-22,20:00,2009-10-22,23:00,180.0,Sugarfactory,Lijnbaansgracht 238,52.364798,4.881735,7.00,8.00,450,,"[FRANÇOIS K, SEBASTIAN SLEEBOS]",false,false
THE SOUND OF REELGROOVE,2009-10-22,20:00,2009-10-23,01:00,300.0,The Mansion,Hobbemastraat 2,52.361452,4.882344,5.00,5.00,,"[SOUL, FUNK]","[DJ MEME, PANEVINO, CENTRAL AVENUE, ALFRED AZZETTO, DUTCHICAN SOUL, LEWIS FERRIER, MILES NUMAN, PHONIC FUNK, CHAPPELL, RAINY PAYNE, MAVIS ACQUAH]",false,false
INNERVISIONS,2009-10-22,22:30,2009-10-23,05:00,390.0,Trouw Amsterdam,Wibautstraat 131,52.354664,4.912051,15.00,17.50,,,,false,false
DOMMELSCH TWSTD DJ CONTEST,2009-10-22,22:00,2009-10-23,01:00,180.0,Twstd,Weteringschans 157,52.359747,4.889935,0.00,0.00,200,,,false,false
BACKWARDS (MOONWALK THRU TIME,2009-10-22,19:00,2009-10-23,03:00,480.0,Werck,Prinsengracht 277,52.374974,4.883672,0.00,0.00,,"[DANCECLASSICS, SOUL, FUNK, DISCO, GROOVE]","[DJ LUCHA, DJ DA-RULE, DJ OLIVIÉR, MISS DADA & DJ NOVICA, ERIC B, GOOD OLD DAVE, RICKY FROM VENEZUELA, JOSHUA WALTER & MISS BROWN, OFF THE WALL/CHOCOMEL, MR. SPEAK & JIMMY AASGIER, ROB BOSKAMP & RICCIARDI, SILVERIUS, LARS VEGAS]",false,false
"ALL IS ONE, DEKMANTEL & BAR27 PRESENT",2009-10-22,22:00,2009-10-23,05:00,420.0,Westerunie,Klönne Plein 4-6,52.386808,4.869991,10.00,15.00,1200,,"[NATHAN FAKE, REMY, ISIS, RICKETIC, MAKAM, TOM TRAGO, DAUPHIN, AROMA JOCKEY ODO7, ARJUNA SCHIKS, OLIVIER WEITER, EGBERT JAN WEEBER, KAMOUFLAGE, LUCATONE, EKE EVI, SAN PROPER, JAN VAN KAMPEN, JUJU & JORDASH]",false,false
NEW CAKE LABEL NIGHT,2009-10-22,22:00,2009-10-23,04:00,360.0,Winston Int.,Warmoesstraat 131,,,7.50,7.50,,"[ALTERNATIVE DANCE, HOUSE, DISCO]",,false,false
